{
  "schema": "lafea-benchmark-audit-record/v1",
  "programId": "BM-MESH",
  "runId": "mesh-1710-m3v2-gate-01",
  "generatedAt": "2026-09-08T01:58:27.892Z",
  "repository": "reallaksh19/Advanced_Analysis",
  "exactHeadSha": "ce8b725f727b7219daf36a5c8d95fd847a8df58b",
  "trackedTreeClean": true,
  "environment": {
    "node": "v26.3.0",
    "platform": "win32",
    "arch": "x64",
    "hostname": "Lakshman"
  },
  "caseId": "MESH",
  "stageId": "M2",
  "methodResults": [
    {
      "methodId": "BM-MESH-M2",
      "materialLeg": "ADV-MESH-1710/LEG-003",
      "benchmarkClass": "STAGED_MESH_BENCHMARK",
      "comparisonPolicy": "FROZEN_CLOSED_FORM_AND_EXPLICIT_POLICY_COMPARISONS_WITH_PRODUCTION_MULTIPATCH_SEAM_IDENTITY",
      "command": [
        "C:\\Program Files\\nodejs\\node.exe",
        "scripts/lafea-mesh-benchmark-run.mjs",
        "--stage",
        "M3",
        "--expected-head",
        "ce8b725f727b7219daf36a5c8d95fd847a8df58b",
        "--run-id",
        "mesh-1710-m3v2-gate-01"
      ],
      "sourceCustody": [
        {
          "sourceId": "S-001",
          "path": "src/workspace/lafea-mesh-producer-registry.js",
          "expectedBlobSha": "b5fccf89dfb99fd09c4faeb6ef1d7db9e08101a6",
          "observedBlobSha": "b5fccf89dfb99fd09c4faeb6ef1d7db9e08101a6",
          "status": "PASS"
        },
        {
          "sourceId": "S-002",
          "path": "src/workspace/lafea-mesh-producer-binding.js",
          "expectedBlobSha": "e8307066293314ad952608872db596cf1898d5c1",
          "observedBlobSha": "e8307066293314ad952608872db596cf1898d5c1",
          "status": "PASS"
        },
        {
          "sourceId": "S-003",
          "path": "src/workspace/lafea-mesh-producer-engine.js",
          "expectedBlobSha": "36fe0e7cb8b95aab8ebc2532578a68a1eb75f558",
          "observedBlobSha": "36fe0e7cb8b95aab8ebc2532578a68a1eb75f558",
          "status": "PASS"
        },
        {
          "sourceId": "S-004",
          "path": "src/workspace/lafea-shell-mesh-producer.js",
          "expectedBlobSha": "6bb02be40673ce79bb3488905c4ee465ad6625df",
          "observedBlobSha": "6bb02be40673ce79bb3488905c4ee465ad6625df",
          "status": "PASS"
        },
        {
          "sourceId": "S-005",
          "path": "src/workspace/lafea-mesh-geometry-topology-adapter.js",
          "expectedBlobSha": "0dea937de150ca5a54cc7750c907fd3fafd7761c",
          "observedBlobSha": "0dea937de150ca5a54cc7750c907fd3fafd7761c",
          "status": "PASS"
        },
        {
          "sourceId": "S-006",
          "path": "src/workspace/lafea-analysis-mesh-contract.js",
          "expectedBlobSha": "c5b9b246321456d3514de4b9294de831b4a82c0e",
          "observedBlobSha": "c5b9b246321456d3514de4b9294de831b4a82c0e",
          "status": "PASS"
        },
        {
          "sourceId": "S-007",
          "path": "src/core/lafea-meshing/quality-gates.js",
          "expectedBlobSha": "da21c333a5bc22e59c4b52c2c1ff135ee7460ebb",
          "observedBlobSha": "da21c333a5bc22e59c4b52c2c1ff135ee7460ebb",
          "status": "PASS"
        },
        {
          "sourceId": "S-008",
          "path": "scripts/lafea.10-quality-gate-check.mjs",
          "expectedBlobSha": "97fa853ba347a65e2ad451ff9bc16488f9d4b146",
          "observedBlobSha": "97fa853ba347a65e2ad451ff9bc16488f9d4b146",
          "status": "PASS"
        },
        {
          "sourceId": "S-009",
          "path": "src/workspace/lafea-stage-analysis-adapter.js",
          "expectedBlobSha": "899afb248fc9864bdbea44f34a4a675d3574e5fa",
          "observedBlobSha": "899afb248fc9864bdbea44f34a4a675d3574e5fa",
          "status": "PASS"
        },
        {
          "sourceId": "S-010",
          "path": "validation/lafea-benchmark-data/B01/sources/source-registry.json",
          "expectedBlobSha": "21d86d5884e42adb462c402ca94b1289c27884f3",
          "observedBlobSha": "21d86d5884e42adb462c402ca94b1289c27884f3",
          "status": "PASS"
        },
        {
          "sourceId": "S-011",
          "path": "src/core/lafea-profile-contract/field-schemas.js",
          "expectedBlobSha": "1f860b106834d16d0400ac2d758d9e38d8051711",
          "observedBlobSha": "1f860b106834d16d0400ac2d758d9e38d8051711",
          "status": "PASS"
        },
        {
          "sourceId": "S-012",
          "path": "src/core/lafea-meshing/mesh-convergence-framework.js",
          "expectedBlobSha": "c06ebf7006b76b38de8c416f659152396d34976e",
          "observedBlobSha": "c06ebf7006b76b38de8c416f659152396d34976e",
          "status": "PASS"
        },
        {
          "sourceId": "S-013",
          "path": "src/workspace/lafea-continuum-physical-probe.js",
          "expectedBlobSha": "f1991fc17f0e799933917601b78c7a89af196df1",
          "observedBlobSha": "f1991fc17f0e799933917601b78c7a89af196df1",
          "status": "PASS"
        },
        {
          "sourceId": "S-014",
          "path": "validation/lafea-benchmark-data/MESH/convergence/mesh-ladders.json",
          "expectedBlobSha": "7be1e34b9e35c35f27be4aae49dfc441090fad4b",
          "observedBlobSha": "7be1e34b9e35c35f27be4aae49dfc441090fad4b",
          "status": "PASS"
        },
        {
          "sourceId": "S-015",
          "path": "validation/lafea-benchmark-data/MESH/convergence/fixed-probes.json",
          "expectedBlobSha": "32436222284374cd94bad09ba4980ce64a0d28e8",
          "observedBlobSha": "32436222284374cd94bad09ba4980ce64a0d28e8",
          "status": "PASS"
        },
        {
          "sourceId": "S-016",
          "path": "src/workspace/lafea-shell-multipatch-midsurface-contract.js",
          "expectedBlobSha": "45158697eb552688f71b68ce09c9e33869f263f2",
          "observedBlobSha": "45158697eb552688f71b68ce09c9e33869f263f2",
          "status": "PASS"
        },
        {
          "sourceId": "S-017",
          "path": "src/workspace/lafea-shell-multipatch-mesh-core.js",
          "expectedBlobSha": "b54063378d8265e5d5905975368b8094c251b8e7",
          "observedBlobSha": "b54063378d8265e5d5905975368b8094c251b8e7",
          "status": "PASS"
        },
        {
          "sourceId": "S-018",
          "path": "src/workspace/lafea-domain-first-requests.js",
          "expectedBlobSha": "51907e33fcf363e1d84fa491e7124a3c961529a0",
          "observedBlobSha": "51907e33fcf363e1d84fa491e7124a3c961529a0",
          "status": "PASS"
        },
        {
          "sourceId": "S-019",
          "path": "src/core/lafea-meshing/mapped-mitc-mesh.js",
          "expectedBlobSha": "4ad4740e3853cfec31ea372710713a8e270619f6",
          "observedBlobSha": "4ad4740e3853cfec31ea372710713a8e270619f6",
          "status": "PASS"
        },
        {
          "sourceId": "S-020",
          "path": "src/workspace/lafea-shell-thickness-basis.js",
          "expectedBlobSha": "643b73a6c6589cb2b2dbaa2879246d6e3ef057f1",
          "observedBlobSha": "643b73a6c6589cb2b2dbaa2879246d6e3ef057f1",
          "status": "PASS"
        },
        {
          "sourceId": "S-021",
          "path": "scripts/lafea.4-fixtures.mjs",
          "expectedBlobSha": "b3e68b24064221a7d35dd1fbb156addfc41667ef",
          "observedBlobSha": "b3e68b24064221a7d35dd1fbb156addfc41667ef",
          "status": "PASS"
        },
        {
          "sourceId": "S-022",
          "path": "scripts/lafea-tech2-thickness-curvature-check.mjs",
          "expectedBlobSha": "31348e942aeca59c17e7c00df3ab4732a60e1cb6",
          "observedBlobSha": "31348e942aeca59c17e7c00df3ab4732a60e1cb6",
          "status": "PASS"
        },
        {
          "sourceId": "S-023",
          "path": "validation/lafea-benchmark-data/MESH/convergence/shell-thickness.json",
          "expectedBlobSha": "b0e408cee23df76d247a9dc7a7ac2bc49c144094",
          "observedBlobSha": "b0e408cee23df76d247a9dc7a7ac2bc49c144094",
          "status": "PASS"
        },
        {
          "sourceId": "S-024",
          "path": "validation/bucket-01/04-t3-patch-oracle.json",
          "expectedBlobSha": "38cdab72f181eb4407a16aaa0753f8770d5989d8",
          "observedBlobSha": "38cdab72f181eb4407a16aaa0753f8770d5989d8",
          "status": "PASS"
        },
        {
          "sourceId": "S-025",
          "path": "scripts/lafea-bucket-01-t3-patch-check.mjs",
          "expectedBlobSha": "47cecae5a5a159ea1ee0e28a0d92990a88f1824e",
          "observedBlobSha": "47cecae5a5a159ea1ee0e28a0d92990a88f1824e",
          "status": "PASS"
        },
        {
          "sourceId": "S-026",
          "path": "src/core/local-continuum/index.js",
          "expectedBlobSha": "6c5184ec3044eef0ea48d1500985eb513e9f34d2",
          "observedBlobSha": "6c5184ec3044eef0ea48d1500985eb513e9f34d2",
          "status": "PASS"
        },
        {
          "sourceId": "S-027",
          "path": "scripts/lafea.4-production-route-benchmarks-check.mjs",
          "expectedBlobSha": "da375442897a302027e15bb3400390ea3c715111",
          "observedBlobSha": "da375442897a302027e15bb3400390ea3c715111",
          "status": "PASS"
        },
        {
          "sourceId": "S-028",
          "path": "src/core/local-shell/index.js",
          "expectedBlobSha": "4af7ff09daae2b0e35edbabce627aa9b546485e2",
          "observedBlobSha": "4af7ff09daae2b0e35edbabce627aa9b546485e2",
          "status": "PASS"
        },
        {
          "sourceId": "S-029",
          "path": "src/core/local-shell/cst.js",
          "expectedBlobSha": "ae140f4c8cfd74c009b3bd9743d1deed00dd89ea",
          "observedBlobSha": "ae140f4c8cfd74c009b3bd9743d1deed00dd89ea",
          "status": "PASS"
        },
        {
          "sourceId": "S-030",
          "path": "validation/lafea-benchmark-data/MESH/convergence/m4-physics-response.json",
          "expectedBlobSha": "7fcf6bea3c31a16973b953568bc9732401422a1b",
          "observedBlobSha": "7fcf6bea3c31a16973b953568bc9732401422a1b",
          "status": "PASS"
        },
        {
          "sourceId": "S-031",
          "path": "scripts/lib/lafea-mesh-benchmark-m4.mjs",